{
  "schema": "kumwe-test-ownership/v1",
  "package": "kumwe/producer",
  "api_manifest": "resources/public-api.json",
  "suite": {
    "inventory_command": [
      "php",
      "tests/run.php",
      "--list-json"
    ]
  },
  "exports": {
    "Kumwe\\Producer\\Canonical\\CanonicalEncodingException": {
      "behavior": [
        "Kumwe\\Producer\\Tests\\Case\\CanonicalJsonTest::testAstralMemberNamesSortByUtf16CodeUnit",
        "Kumwe\\Producer\\Tests\\Case\\CanonicalJsonTest::testReplaysTheCompleteCanonicalCorpus"
      ],
      "boundary": [
        "Kumwe\\Producer\\Tests\\Case\\CanonicalJsonTest::testInvalidUtf8AndNumbersOutsideTheSafeRangeAreRefused"
      ],
      "note": "Package-owned behavior and refusal cases; these references identify evidence, not percentage coverage."
    },
    "Kumwe\\Producer\\Canonical\\CanonicalJson": {
      "behavior": [
        "Kumwe\\Producer\\Tests\\Case\\CanonicalJsonTest::testAstralMemberNamesSortByUtf16CodeUnit",
        "Kumwe\\Producer\\Tests\\Case\\CanonicalJsonTest::testReplaysTheCompleteCanonicalCorpus"
      ],
      "boundary": [
        "Kumwe\\Producer\\Tests\\Case\\CanonicalJsonTest::testInvalidUtf8AndNumbersOutsideTheSafeRangeAreRefused"
      ],
      "note": "Package-owned behavior and refusal cases; these references identify evidence, not percentage coverage."
    },
    "Kumwe\\Producer\\Css\\BaseStylesheet": {
      "behavior": [
        "Kumwe\\Producer\\Tests\\Case\\CssStylesheetTest::testBaseStylesheetCarriesTheAttributeVocabulary",
        "Kumwe\\Producer\\Tests\\Case\\CssStylesheetTest::testScopedStylesCompileTheClosedVocabulary"
      ],
      "boundary": [
        "Kumwe\\Producer\\Tests\\Case\\CssStylesheetTest::testScopedStylesFailClosed",
        "Kumwe\\Producer\\Tests\\Case\\CssStylesheetTest::testThemeTokensFailClosed"
      ],
      "note": "Package-owned behavior and refusal cases; these references identify evidence, not percentage coverage."
    },
    "Kumwe\\Producer\\Css\\CssException": {
      "behavior": [
        "Kumwe\\Producer\\Tests\\Case\\CssStylesheetTest::testBaseStylesheetCarriesTheAttributeVocabulary",
        "Kumwe\\Producer\\Tests\\Case\\CssStylesheetTest::testScopedStylesCompileTheClosedVocabulary"
      ],
      "boundary": [
        "Kumwe\\Producer\\Tests\\Case\\CssStylesheetTest::testScopedStylesFailClosed",
        "Kumwe\\Producer\\Tests\\Case\\CssStylesheetTest::testThemeTokensFailClosed"
      ],
      "note": "Package-owned behavior and refusal cases; these references identify evidence, not percentage coverage."
    },
    "Kumwe\\Producer\\Css\\ScopedStylesheet": {
      "behavior": [
        "Kumwe\\Producer\\Tests\\Case\\CssStylesheetTest::testBaseStylesheetCarriesTheAttributeVocabulary",
        "Kumwe\\Producer\\Tests\\Case\\CssStylesheetTest::testScopedStylesCompileTheClosedVocabulary"
      ],
      "boundary": [
        "Kumwe\\Producer\\Tests\\Case\\CssStylesheetTest::testScopedStylesFailClosed",
        "Kumwe\\Producer\\Tests\\Case\\CssStylesheetTest::testThemeTokensFailClosed"
      ],
      "note": "Package-owned behavior and refusal cases; these references identify evidence, not percentage coverage."
    },
    "Kumwe\\Producer\\Css\\ThemeStylesheet": {
      "behavior": [
        "Kumwe\\Producer\\Tests\\Case\\CssStylesheetTest::testBaseStylesheetCarriesTheAttributeVocabulary",
        "Kumwe\\Producer\\Tests\\Case\\CssStylesheetTest::testScopedStylesCompileTheClosedVocabulary"
      ],
      "boundary": [
        "Kumwe\\Producer\\Tests\\Case\\CssStylesheetTest::testScopedStylesFailClosed",
        "Kumwe\\Producer\\Tests\\Case\\CssStylesheetTest::testThemeTokensFailClosed"
      ],
      "note": "Package-owned behavior and refusal cases; these references identify evidence, not percentage coverage."
    },
    "Kumwe\\Producer\\Deployment\\DeploymentException": {
      "behavior": [
        "Kumwe\\Producer\\Tests\\Case\\DeploymentEmitterTest::testEveryDeploymentRefusalIsTypedAndFailsClosed",
        "Kumwe\\Producer\\Tests\\Case\\BrowserAssetLocatorTest::testInadmissibleBasesAndRolesAreRefused"
      ],
      "boundary": [
        "Kumwe\\Producer\\Tests\\Case\\ContentSecurityPolicyTest::testWeakNoncesAndInadmissibleOriginsAreRefused",
        "Kumwe\\Producer\\Tests\\Case\\FetchMetadataPolicyTest::testEveryOtherRequestShapeIsRefusedWithAStableCode"
      ],
      "note": "Package-owned behavior and refusal cases; these references identify evidence, not percentage coverage."
    },
    "Kumwe\\Producer\\Deployment\\SameOriginFetchMetadataPolicy": {
      "behavior": [
        "Kumwe\\Producer\\Tests\\Case\\FetchMetadataPolicyTest::testTheExactSameOriginFetchTupleIsAdmitted"
      ],
      "boundary": [
        "Kumwe\\Producer\\Tests\\Case\\FetchMetadataPolicyTest::testEveryOtherRequestShapeIsRefusedWithAStableCode"
      ],
      "note": "Package-owned behavior and refusal cases; these references identify evidence, not percentage coverage."
    },
    "Kumwe\\Producer\\Deployment\\StudioBrowserAssetLocation": {
      "behavior": [
        "Kumwe\\Producer\\Tests\\Case\\BrowserAssetLocatorTest::testTheNpmPackageLayoutBindsPackageVersionPathAndIntegrity",
        "Kumwe\\Producer\\Tests\\Case\\BrowserAssetLocatorTest::testTheReleaseDirectoryLayoutServesSameOriginWithoutAnOrigin"
      ],
      "boundary": [
        "Kumwe\\Producer\\Tests\\Case\\BrowserAssetLocatorTest::testInadmissibleBasesAndRolesAreRefused"
      ],
      "note": "Package-owned behavior and refusal cases; these references identify evidence, not percentage coverage."
    },
    "Kumwe\\Producer\\Deployment\\StudioBrowserAssetLocator": {
      "behavior": [
        "Kumwe\\Producer\\Tests\\Case\\BrowserAssetLocatorTest::testTheNpmPackageLayoutBindsPackageVersionPathAndIntegrity",
        "Kumwe\\Producer\\Tests\\Case\\BrowserAssetLocatorTest::testTheReleaseDirectoryLayoutServesSameOriginWithoutAnOrigin"
      ],
      "boundary": [
        "Kumwe\\Producer\\Tests\\Case\\BrowserAssetLocatorTest::testInadmissibleBasesAndRolesAreRefused"
      ],
      "note": "Package-owned behavior and refusal cases; these references identify evidence, not percentage coverage."
    },
    "Kumwe\\Producer\\Deployment\\StudioContentSecurityPolicy": {
      "behavior": [
        "Kumwe\\Producer\\Tests\\Case\\ContentSecurityPolicyTest::testTheAuthoringPolicyIsTheManifestTemplateWithANonceAndExactOrigins",
        "Kumwe\\Producer\\Tests\\Case\\ContentSecurityPolicyTest::testTheEnhancementPolicyIsTheManifestBaselineWithExactOrigins"
      ],
      "boundary": [
        "Kumwe\\Producer\\Tests\\Case\\ContentSecurityPolicyTest::testWeakNoncesAndInadmissibleOriginsAreRefused"
      ],
      "note": "Package-owned behavior and refusal cases; these references identify evidence, not percentage coverage."
    },
    "Kumwe\\Producer\\Deployment\\StudioDeploymentEmitter": {
      "behavior": [
        "Kumwe\\Producer\\Tests\\Case\\DeploymentEmitterTest::testAHostedDeploymentRendersAnInertEscapedDiscoveryPair",
        "Kumwe\\Producer\\Tests\\Case\\DeploymentEmitterTest::testAStandaloneDeploymentNeedsOnlyItsReleaseBinding"
      ],
      "boundary": [
        "Kumwe\\Producer\\Tests\\Case\\DeploymentEmitterTest::testEveryDeploymentRefusalIsTypedAndFailsClosed"
      ],
      "note": "Package-owned behavior and refusal cases; these references identify evidence, not percentage coverage."
    },
    "Kumwe\\Producer\\Error\\ContractGrammar": {
      "behavior": [
        "Kumwe\\Producer\\Tests\\Case\\ErrorTaxonomyTest::testCanonicalBytesMatchThePinnedConflictExample",
        "Kumwe\\Producer\\Tests\\Case\\ErrorTaxonomyTest::testCanonicalErrorsRoundTripForProtectedReplay"
      ],
      "boundary": [
        "Kumwe\\Producer\\Tests\\Case\\ErrorTaxonomyTest::testDiagnosticsEnforceTheirBoundedStructure",
        "Kumwe\\Producer\\Tests\\Case\\ErrorTaxonomyTest::testHostRefusalCarriesOnlyTheStructuredError"
      ],
      "note": "Exercised through the owning public collaborator Kumwe\\Producer\\Error\\Diagnostic; public signature pinning runs separately."
    },
    "Kumwe\\Producer\\Error\\Diagnostic": {
      "behavior": [
        "Kumwe\\Producer\\Tests\\Case\\ErrorTaxonomyTest::testCanonicalBytesMatchThePinnedConflictExample",
        "Kumwe\\Producer\\Tests\\Case\\ErrorTaxonomyTest::testCanonicalErrorsRoundTripForProtectedReplay"
      ],
      "boundary": [
        "Kumwe\\Producer\\Tests\\Case\\ErrorTaxonomyTest::testDiagnosticsEnforceTheirBoundedStructure",
        "Kumwe\\Producer\\Tests\\Case\\ErrorTaxonomyTest::testHostRefusalCarriesOnlyTheStructuredError"
      ],
      "note": "Package-owned behavior and refusal cases; these references identify evidence, not percentage coverage."
    },
    "Kumwe\\Producer\\Error\\DiagnosticLocation": {
      "behavior": [
        "Kumwe\\Producer\\Tests\\Case\\ErrorTaxonomyTest::testCanonicalBytesMatchThePinnedConflictExample",
        "Kumwe\\Producer\\Tests\\Case\\ErrorTaxonomyTest::testCanonicalErrorsRoundTripForProtectedReplay"
      ],
      "boundary": [
        "Kumwe\\Producer\\Tests\\Case\\ErrorTaxonomyTest::testDiagnosticsEnforceTheirBoundedStructure",
        "Kumwe\\Producer\\Tests\\Case\\ErrorTaxonomyTest::testHostRefusalCarriesOnlyTheStructuredError"
      ],
      "note": "Package-owned behavior and refusal cases; these references identify evidence, not percentage coverage."
    },
    "Kumwe\\Producer\\Error\\HostError": {
      "behavior": [
        "Kumwe\\Producer\\Tests\\Case\\ErrorTaxonomyTest::testCanonicalBytesMatchThePinnedConflictExample",
        "Kumwe\\Producer\\Tests\\Case\\ErrorTaxonomyTest::testCanonicalErrorsRoundTripForProtectedReplay"
      ],
      "boundary": [
        "Kumwe\\Producer\\Tests\\Case\\ErrorTaxonomyTest::testDiagnosticsEnforceTheirBoundedStructure",
        "Kumwe\\Producer\\Tests\\Case\\ErrorTaxonomyTest::testHostRefusalCarriesOnlyTheStructuredError"
      ],